{
  "config_metadata": {
    "config_id": "DEFI_BRW_RETAIL_UNDERCOLL",
    "description": "Retail borrower - under-collateralized, high leverage, minimal buffer above liquidation",
    "version": "1.0.0",
    "collection_file": "DeFi-HealthFactor-CollateralVelocity-90d.json"
  },

  "protocol": {
    "source": "file",
    "file": "protocols/aave-v3.json"
  },

  "borrower_thresholds": {
    "source": "inline",
    "inline": {
      "min_health_factor_comfort": 1.15,
      "repay_trigger_health_factor": 1.2,
      "aggressive_repay_fraction": 0.20,
      "moderate_repay_fraction": 0.08,
      "safe_horizon_days": 14,
      "urgent_days": 3,
      "max_ltv_target": 0.85,
      "gas_price_abort_gwei": 200
    }
  },

  "market_scenario": {
    "source": "file",
    "file": "market-scenarios/moderate-correction.json"
  },

  "liquidation_scenario": {
    "source": "file",
    "file": "liquidation-scenarios/approaching-threshold.json"
  },

  "simulation_timeframe": {
    "status_date": "2026-02-28T00:00:00",
    "start_date": "2026-03-01T00:00:00",
    "end_date": "2026-05-31T00:00:00",
    "frequency": "daily"
  }
}
